{
  "spec": "librarium.run/1",
  "id": "run_01JAB2C3D4E5F6G7H8J9K0M1N2",
  "question": "Replacing GA4 for an EU SaaS: compare Plausible, Fathom, and Matomo",
  "depth": "deep",
  "status": "running",
  "created_at": "2026-10-12T18:04:11Z",
  "finished_at": null,
  "cost": {
    "estimated": "0.40",
    "reported": "0.10",
    "complete": false,
    "max": "1.00"
  },
  "results": [
    {
      "source": "exa",
      "status": "done",
      "observation": "api",
      "answer": "## Findings\nPlausible fits small sites.",
      "citations": [
        {
          "url": "https://plausible.io/features",
          "title": "Plausible features"
        }
      ],
      "cost": {
        "estimated": "0.10",
        "reported": "0.10"
      },
      "started_at": "2026-10-12T18:04:12Z",
      "duration_ms": 122000,
      "provenance": {
        "provider": "exa",
        "variant": "research",
        "model": null,
        "collector": null
      },
      "error": null
    },
    {
      "source": "openai",
      "status": "running",
      "observation": "api",
      "answer": null,
      "citations": [],
      "cost": {
        "estimated": "0.30",
        "reported": null
      },
      "started_at": "2026-10-12T18:04:12Z",
      "duration_ms": null,
      "provenance": {
        "provider": "openai",
        "variant": "research",
        "model": null,
        "collector": null
      },
      "error": null
    }
  ],
  "skipped": [
    {
      "source": "kagi",
      "reason": "no_deep_variant"
    }
  ],
  "notices": []
}
