{
  "spec": "librarium.run/1",
  "id": "run_01JAB2C3D4E5F6G7H8J9K0M1N2",
  "question": "Replacing GA4 for an EU SaaS: compare Plausible, Fathom, and Matomo",
  "depth": "quick",
  "status": "partial",
  "created_at": "2026-10-12T18:04:11Z",
  "finished_at": "2026-10-12T18:06:14Z",
  "cost": {
    "estimated": "0.01",
    "reported": null,
    "complete": false,
    "max": null
  },
  "results": [
    {
      "source": "chatgpt",
      "status": "done",
      "observation": "surface",
      "answer": "## Findings\nPlausible fits small sites.",
      "citations": [
        {
          "url": "https://plausible.io/features",
          "title": "Plausible features"
        }
      ],
      "cost": {
        "estimated": null,
        "reported": null
      },
      "started_at": "2026-10-12T18:04:12Z",
      "duration_ms": 122000,
      "provenance": {
        "provider": "chatgpt",
        "variant": "surface",
        "model": null,
        "collector": "searchapi"
      },
      "error": null
    },
    {
      "source": "kagi",
      "status": "failed",
      "observation": "api",
      "answer": null,
      "citations": [],
      "cost": {
        "estimated": "0.01",
        "reported": null
      },
      "started_at": "2026-10-12T18:04:12Z",
      "duration_ms": 122000,
      "provenance": {
        "provider": "kagi",
        "variant": "grounded",
        "model": null,
        "collector": null
      },
      "error": {
        "code": "timeout",
        "message": "Kagi did not answer within 30s.",
        "retryable": true
      }
    }
  ],
  "skipped": [],
  "notices": []
}
